{
  "$id": "https://intentcue.dev/schemas/ReviewJson.schema.json",
  "title": "ReviewJson",
  "$schema": "https://json-schema.org/draft/2020-12/schema",
  "type": "object",
  "properties": {
    "version": {
      "type": "number",
      "const": 1
    },
    "round": {
      "type": "integer",
      "minimum": -9007199254740991,
      "maximum": 9007199254740991
    },
    "app": {
      "type": "string"
    },
    "instructions": {
      "type": "array",
      "items": {
        "type": "object",
        "properties": {
          "id": {
            "type": "string"
          },
          "screenId": {
            "type": "string"
          },
          "action": {
            "type": "string",
            "enum": [
              "remove",
              "change",
              "move",
              "add",
              "relate",
              "note"
            ]
          },
          "targets": {
            "type": "array",
            "items": {
              "type": "object",
              "properties": {
                "elementId": {
                  "type": "string"
                },
                "type": {
                  "type": "string"
                },
                "label": {
                  "type": "string"
                },
                "bounds": {
                  "type": "object",
                  "properties": {
                    "x": {
                      "type": "number"
                    },
                    "y": {
                      "type": "number"
                    },
                    "w": {
                      "type": "number"
                    },
                    "h": {
                      "type": "number"
                    }
                  },
                  "required": [
                    "x",
                    "y",
                    "w",
                    "h"
                  ],
                  "additionalProperties": false
                },
                "source": {
                  "type": "object",
                  "properties": {
                    "file": {
                      "type": "string"
                    },
                    "line": {
                      "type": "integer",
                      "minimum": -9007199254740991,
                      "maximum": 9007199254740991
                    },
                    "component": {
                      "type": "string"
                    }
                  },
                  "required": [
                    "file"
                  ],
                  "additionalProperties": false
                }
              },
              "required": [
                "elementId",
                "type",
                "bounds"
              ],
              "additionalProperties": false
            }
          },
          "destination": {
            "anyOf": [
              {
                "type": "object",
                "properties": {
                  "elementId": {
                    "type": "string"
                  },
                  "type": {
                    "type": "string"
                  },
                  "label": {
                    "type": "string"
                  },
                  "bounds": {
                    "type": "object",
                    "properties": {
                      "x": {
                        "type": "number"
                      },
                      "y": {
                        "type": "number"
                      },
                      "w": {
                        "type": "number"
                      },
                      "h": {
                        "type": "number"
                      }
                    },
                    "required": [
                      "x",
                      "y",
                      "w",
                      "h"
                    ],
                    "additionalProperties": false
                  },
                  "source": {
                    "type": "object",
                    "properties": {
                      "file": {
                        "type": "string"
                      },
                      "line": {
                        "type": "integer",
                        "minimum": -9007199254740991,
                        "maximum": 9007199254740991
                      },
                      "component": {
                        "type": "string"
                      }
                    },
                    "required": [
                      "file"
                    ],
                    "additionalProperties": false
                  }
                },
                "required": [
                  "elementId",
                  "type",
                  "bounds"
                ],
                "additionalProperties": false
              },
              {
                "type": "object",
                "properties": {
                  "region": {
                    "type": "object",
                    "properties": {
                      "x": {
                        "type": "number"
                      },
                      "y": {
                        "type": "number"
                      },
                      "w": {
                        "type": "number"
                      },
                      "h": {
                        "type": "number"
                      }
                    },
                    "required": [
                      "x",
                      "y",
                      "w",
                      "h"
                    ],
                    "additionalProperties": false
                  }
                },
                "required": [
                  "region"
                ],
                "additionalProperties": false
              }
            ]
          },
          "destinationScreenId": {
            "type": "string"
          },
          "text": {
            "type": "string"
          },
          "instruction": {
            "type": "string"
          },
          "status": {
            "type": "string",
            "enum": [
              "resolved",
              "unresolved"
            ]
          },
          "annotationIds": {
            "type": "array",
            "items": {
              "type": "string"
            }
          },
          "marker": {
            "type": "integer",
            "minimum": -9007199254740991,
            "maximum": 9007199254740991
          },
          "needsText": {
            "type": "boolean"
          },
          "ink": {
            "type": "array",
            "items": {
              "type": "string"
            }
          }
        },
        "required": [
          "id",
          "screenId",
          "action",
          "targets",
          "text",
          "instruction",
          "status",
          "annotationIds",
          "marker"
        ],
        "additionalProperties": false
      }
    },
    "rules": {
      "type": "array",
      "items": {
        "type": "object",
        "properties": {
          "id": {
            "type": "string"
          },
          "text": {
            "type": "string"
          },
          "examples": {
            "type": "array",
            "items": {
              "type": "object",
              "properties": {
                "screenId": {
                  "type": "string"
                },
                "target": {
                  "type": "object",
                  "properties": {
                    "elementId": {
                      "type": "string"
                    },
                    "type": {
                      "type": "string"
                    },
                    "label": {
                      "type": "string"
                    },
                    "bounds": {
                      "type": "object",
                      "properties": {
                        "x": {
                          "type": "number"
                        },
                        "y": {
                          "type": "number"
                        },
                        "w": {
                          "type": "number"
                        },
                        "h": {
                          "type": "number"
                        }
                      },
                      "required": [
                        "x",
                        "y",
                        "w",
                        "h"
                      ],
                      "additionalProperties": false
                    },
                    "source": {
                      "type": "object",
                      "properties": {
                        "file": {
                          "type": "string"
                        },
                        "line": {
                          "type": "integer",
                          "minimum": -9007199254740991,
                          "maximum": 9007199254740991
                        },
                        "component": {
                          "type": "string"
                        }
                      },
                      "required": [
                        "file"
                      ],
                      "additionalProperties": false
                    }
                  },
                  "required": [
                    "elementId",
                    "type",
                    "bounds"
                  ],
                  "additionalProperties": false
                }
              },
              "required": [
                "screenId",
                "target"
              ],
              "additionalProperties": false
            }
          },
          "annotationId": {
            "type": "string"
          }
        },
        "required": [
          "id",
          "text",
          "examples",
          "annotationId"
        ],
        "additionalProperties": false
      }
    },
    "counts": {
      "type": "object",
      "properties": {
        "instructions": {
          "type": "integer",
          "minimum": -9007199254740991,
          "maximum": 9007199254740991
        },
        "unresolved": {
          "type": "integer",
          "minimum": -9007199254740991,
          "maximum": 9007199254740991
        },
        "needsText": {
          "type": "integer",
          "minimum": -9007199254740991,
          "maximum": 9007199254740991
        },
        "rules": {
          "type": "integer",
          "minimum": -9007199254740991,
          "maximum": 9007199254740991
        }
      },
      "required": [
        "instructions",
        "unresolved",
        "needsText",
        "rules"
      ],
      "additionalProperties": false
    }
  },
  "required": [
    "version",
    "round",
    "app",
    "instructions",
    "rules",
    "counts"
  ],
  "additionalProperties": false
}
